Title,Authors,Contributors,ISBN/UID,Format,Read Status,Date Added,Last Date Read,Dates Read,Read Count,Moods,Pace,Character- or Plot-Driven?,Strong Character Development?,Loveable Characters?,Diverse Characters?,Flawed Characters?,Star Rating,Review,Content Warnings,Content Warning Description,Tags,Owned?
The Wise Man's Fear,Patrick Rothfuss,"",9780756404734,hardcover,read,2019/03/14,2019/03/18,2019/03/18,1,"",,,,,,,4.0,,"",,"",No
Parade,Rachel Cusk,"",9780374610043,hardcover,to-read,2024/10/31,"","",0,"",,,,,,,,,"",,"",No
"The Memoirs of Sherlock Holmes (Sherlock Holmes, #4)",Arthur Conan Doyle,"Christopher Roden, Owen Dudley Edwards",9780192123091,hardcover,read,2019/04/04,2019/04/04,2019/04/04,1,"",,,,,,,4.0,,"",,"",No
Wonder,R.J. Palacio,"",9780375869020,hardcover,to-read,2020/04/13,"","",0,"",,,,,,,,,"",,"",No
Sideswipe: A Hoke Moseley Detective Thriller,Charles Willeford,"",9781400032488,paperback,to-read,2024/06/15,"","",0,"",,,,,,,,,"",,"",No
Las Palabras y Los D-As.: Una Antolog-A Introductoria,"Octavio Paz, Ricardo Cayuela Gally","",9786071618214,paperback,read,2015/10/17,"","",1,"",,,,,,,4.0,,"",,"",No
Who's Afraid of Virginia Woolf?,Edward Albee,"",9780451218599,paperback,to-read,2016/06/11,"","",0,"",,,,,,,,,"",,"",No
Pedro Páramo / El Llano en llamas,Juan Rulfo,"",9788408066439,paperback,read,2015/10/07,"","",1,"",,,,,,,5.0,,"",,"",No
Deep Work: Rules for Focused Success in a Distracted World,Cal Newport,"",9781455586691,hardcover,read,2016/11/11,2017/02/28,2017/02/28,2,"",,,,,,,4.0,,"",,"",No
A Game of Thrones,George R.R. Martin,"",9780553588484,paperback,read,2015/10/08,"","",1,"",,,,,,,4.0,,"",,"",No
All the Sinners Bleed,S.A. Cosby,"",9781250831910,hardcover,to-read,2023/11/28,"","",0,"",,,,,,,,,"",,"",No
El complot mongol,Rafael Bernal,"",9786070717390,,to-read,2016/12/08,"","",0,"",,,,,,,,,"",,"",No
The Bad Beginning,Lemony Snicket,Brett Helquist (Illustrator),9780439206471,paperback,read,2017/01/23,2017/01/23,2017/01/23,1,"",,,,,,,4.0,,"",,"",No
Helter Skelter: The True Story of the Manson Murders,Vincent Bugliosi,Curt Gentry,9780393322231,paperback,read,2020/01/28,2020/02/20,2020/02/20,1,"",,,,,,,5.0,,"",,"",No
Three Days of the Condor,James Grady,"","",hardcover,read,2024/08/03,2024/11/04,2024/11/04,1,"",,,,,,,5.0,,"",,"",No
The Shell Seekers,Rosamunde Pilcher,"",9780517222850,hardcover,to-read,2025/10/25,"","",0,"",,,,,,,,,"",,"",No
The Hunger Games,Suzanne Collins,"",9780439023481,hardcover,read,2015/10/08,"","",1,"",,,,,,,4.0,,"",,"",No
Mockingjay,Suzanne Collins,"",9780439023511,hardcover,read,2015/10/08,"","",1,"",,,,,,,3.0,,"",,"",No
Where I'm Calling from,Raymond Carver,"",9780679722311,paperback,read,2015/10/08,2016/05/22,2016/05/22,1,"",,,,,,,2.0,,"",,"",No
Seven Brief Lessons on Physics,Carlo Rovelli,"Simon Carnell (Translator), Erica Segre (Translator)",9780399184413,hardcover,read,2017/06/18,2018/12/04,2018/12/04,1,"",,,,,,,4.0,,"",,"",No
Stranger Things Happen: Stories,Kelly Link,"",9781931520003,paperback,to-read,2025/07/28,"","",0,"",,,,,,,,,"",,"",No
The Sittaford Mystery,Agatha Christie,"",9780007136841,paperback,to-read,2025/09/06,"","",0,"",,,,,,,,,"",,"",No
The Pelican Brief,John Grisham,"",9780385339704,paperback,read,2022/10/02,2022/10/02,2022/10/02,1,"",,,,,,,5.0,,"",,"",No
The Sun Is Also a Star,Nicola Yoon,"",9780553496680,hardcover,to-read,2016/12/08,"","",0,"",,,,,,,,,"",,"",No
The Collected Poems,Wallace Stevens,"",9780679726692,paperback,to-read,2019/04/17,"","",0,"",,,,,,,,,"",,"",No
Romance de la Negra Rubia,Gabriela Cabezón Cámara,"",9789877120226,paperback,read,2024/08/30,2024/09/13,2024/09/13,1,"",,,,,,,1.0,,"",,"",No
Mother Night,Kurt Vonnegut,"",9780385334143,paperback,to-read,2023/10/13,"","",0,"",,,,,,,,,"",,"",No
The Sun Also Rises,Ernest Hemingway,"","",paperback,read,2015/10/07,"","",1,"",,,,,,,5.0,"I loved this book. The way that it navigates through the party in Spain is amazing. Again, if you had to point out a deficiency it would be how under-written the few women are. Outside from that, an all-around amazing reading experience","",,"",No
Spark Joy: An Illustrated Master Class on the Art of Organizing and Tidying Up,Marie Kondo,Cathy Hirano (Translator),9781607749721,hardcover,read,2019/10/05,2019/11/04,2019/11/04,1,"",,,,,,,4.0,,"",,"",No
Aunt Julia and the Scriptwriter,Mario Vargas Llosa,Helen R. Lane (Translator),9780140248920,paperback,read,2015/10/07,"","",1,"",,,,,,,5.0,,"",,"",No
The Wife Between Us,"Greer Hendricks, Sarah Pekkanen","",9781250130921,hardcover,to-read,2018/10/31,"","",0,"",,,,,,,,,"",,"",No
Strangers on a Train,Patricia Highsmith,"",9780393321982,paperback,to-read,2025/09/08,"","",0,"",,,,,,,,,"",,"",No
The Art of Fiction,Henry James,"",9781172438099,paperback,to-read,2022/11/05,"","",0,"",,,,,,,,,"",,"",No
If on a Winter's Night a Traveler,Italo Calvino,"William Weaver (Translator), Jefferson Mays (Narrator)",9781501963155,audio,read,2015/10/12,2015/11/24,2015/11/24,1,"",,,,,,,2.0,"I get what he did, I just couldn't get behind it personally.","",,"",No
The Feynman Lectures on Physics,Richard P. Feynman,"Matthew L. Sands, Robert B. Leighton",9780805390452,hardcover,read,2015/10/17,"","",1,"",,,,,,,4.0,,"",,"",No
L.A. Confidential,James Ellroy,Freddy Michalski,9782743602680,paperback,to-read,2016/12/08,"","",0,"",,,,,,,,,"",,"",No
Pedro Páramo,Juan Rulfo,"Susan Sontag (Contributor), Margaret Sayers Peden (Translator)",9780802133908,paperback,read,2016/06/18,"","",1,"",,,,,,,4.0,,"",,"",No
Prince Caspian,C.S. Lewis,"",9780007202300,hardcover,read,2015/10/07,"","",1,"",,,,,,,2.0,,"",,"",No
The Map and the Territory,Michel Houellebecq,"",9780434021406,hardcover,read,2016/04/15,2016/05/02,2016/05/02,1,"",,,,,,,2.0,,"",,"",No
So Smart in Their Fine Uniforms,Kurt Busiek,Carlos Pacheco,9781401202996,paperback,to-read,2024/08/06,"","",0,"",,,,,,,,,"",,"",No
El extranjero,"José Ángel Valente, Albert Camus","","",digital,read,2016/11/26,2016/11/28,2016/11/28,1,"",,,,,,,4.0,,"",,"",No
Alice's Adventures in Wonderland / Through the Looking-Glass,Lewis Carroll,"",0553213458,paperback,read,2016/01/25,"","",1,"",,,,,,,5.0,,"",,"",No
Tales of Terror: 58 Short Stories Chosen by the Master of Suspense,"Talmage Powell, Edward Wellen, Robert Colby, Theodore Mathieson, Bob Bristow, Richard O. Lewis, John Coyne, Charlotte Edwards, Bryce Walton, Michael Brett, Samuel W. Taylor, Brian Garfield, Harold Q. Masur, John Lutz, Betty Ren Wright, Michael Zuroy, Alice Scanlan Reach, Arthur Porges, Clayton Matthews, James M. Gilmore, Alfred Hitchcock, Al Nussbaum, Robert W. Alexander, Pauline C. Smith, Nedra Tyre, Donald Olson, William Brittain, Vincent McConnor, John F. Suter, Gary Brandner, Patricia Matthews, Mary Braund, Nelson DeMille, William P. McGivern, James Holding, Stephen Wasylyk, Barry N. Malzberg, Isak Romun, S.S. Rafferty, Helen Nielsen, Fletcher Flora, Irving Schiffer, Margaret B. Maron, Borden Deal, Libby MacCall, Jack Ritchie, Frank Sisk, Eleanor Sullivan, Hal Ellson, Donald Honig","",,hardcover,to-read,2025/07/28,"","",0,"",,,,,,,,,"",,"",No
Un escándalo en Bohemia,Arthur Conan Doyle,"",9781979475853,paperback,read,2018/08/29,"","",1,"",,,,,,,5.0,,"",,"",No
The Complete Robot Part 2 of 2,Isaac Asimov,"",9785557082372,audio,read,2020/03/23,2020/04/20,2020/04/20,1,"",,,,,,,5.0,,"",,"",No
Love in the Time of Cholera,Gabriel García Márquez,Edith Grossman (Translator),9781400034680,paperback,read,2015/10/07,"","",1,"",,,,,,,5.0,"It was an interesting take on the usual love story. And what I think put it over the edge for me in comparison to other novels that are centered on a singular love story is that the middle was actually enjoyable. And I don't mean to say that I don't like other novels with love stories or that the other ones are bad. But I sort of expected the classic story: boy-meets-girl, long interlude of sometime unnecessary problems, boy-gets-girl. And the take on the story and the compelling protagonist kept me entertained the whole way.","",,"",No
La tía Julia y el escribidor,Mario Vargas Llosa,"",9788466368520,paperback,read,2016/04/07,2016/04/15,2016/04/15,1,"",,,,,,,5.0,,"",,"",No
Las batallas en el desierto,José Emilio Pacheco,"",9789684114739,paperback,read,2015/10/17,2025/07/27,"2025/07/27-2025/07/27, 2016/11/28",2,"",,,,,,,5.0,,"",,"",No
New Hope for the Dead,Charles Willeford,"",9781400032495,paperback,to-read,2024/06/15,"","",0,"",,,,,,,,,"",,"",No
Rebel of the Sands,Alwyn Hamilton,"",9780451477538,hardcover,to-read,2016/12/08,"","",0,"",,,,,,,,,"",,"",No
La ciudad y los perros,Mario Vargas Llosa,"",9788466309158,paperback,read,2015/10/17,2016/01/25,2016/01/25,2,"",,,,,,,5.0,"Enorme Vargas Llosa de nuevo. No tenia planeado seguir leyendolo despues de la decepcion de su mas reciente libro. Sin embargo, le di otro chance y pago dividendos. Uno de sus mejores libros y muy recomendable","",,"",No
Harry Potter and the Deathly Hallows,J.K. Rowling,"",9781408894743,paperback,read,2015/10/08,"","",1,"",,,,,,,4.0,,"",,"",No
Harry Potter and the Order of the Phoenix,J.K. Rowling,"",9781408855690,paperback,read,2015/10/08,"","",1,"",,,,,,,3.0,,"",,"",No
Night Prey,John Sandford,"",9780006478966,paperback,read,2024/04/19,2024/05/15,2024/05/15,1,"",,,,,,,3.0,,"",,"",No
A Connecticut Yankee in King Arthur's Court,Mark Twain,"T.E.D. Klein, Joseph Ciardiello",9780895771858,hardcover,read,2015/10/07,2015/10/22,2015/10/22,1,"",,,,,,,3.0,"Not my cup of tea. Quite funny but I don't think it has aged well. Still, every word written by Mark Twain is worth reading because he was such a funny guy.","",,"",No
If It Bleeds,Stephen King,"","",hardcover,to-read,2025/09/06,"","",0,"",,,,,,,,,"",,"",No
La invención de Morel,Adolfo Bioy Casares,"",9780140260847,paperback,read,2024/08/20,2024/08/25,2024/08/25,1,"",,,,,,,4.0,,"",,"",No
A Christmas Carol,Charles Dickens,Joe L. Wheeler,9781561797462,paperback,read,2015/10/07,"","",1,"",,,,,,,4.0,Great book. A bit dated tho.,"",,"",No
Silver Blaze,Arthur Conan Doyle,"",9791680000,paperback,read,2018/10/29,2018/10/30,2018/10/30,1,"",,,,,,,4.0,,"",,"",No
No sin Nosotros: Los dias del terremoto 1985-2005,Carlos Monsiváis,"",9789684116412,paperback,to-read,2016/06/20,"","",0,"",,,,,,,,,"",,"",No
The Complete Eightball 1-18,Daniel Clowes,"",9781606997574,hardcover,to-read,2021/07/14,"","",0,"",,,,,,,,,"",,"",No
The Fifth to Die,J.D. Barker,"",9780544980662,digital,read,2019/09/05,2019/09/11,2019/09/11,1,"",,,,,,,3.0,,"",,"",No
The Color of Magic,Terry Pratchett,"",9780060855925,paperback,to-read,2016/07/04,"","",0,"",,,,,,,,,"",,"",No
The Silver Chair,C.S. Lewis,"",9780007323098,paperback,read,2015/10/07,"","",1,"",,,,,,,2.0,,"",,"",No
Night Buffalo,Guillermo Arriaga,Alan Page (Translator),9780743281867,paperback,to-read,2016/11/11,"","",0,"",,,,,,,,,"",,"",No
Among the Burning Flowers,Samantha Shannon,Rovina Cai (Illustrator),9781526685254,hardcover,to-read,2025/07/29,"","",0,"",,,,,,,,,"",,"",No
Estas ruinas que ves,Jorge Ibargüengoitia,"",9789682704390,paperback,read,2024/08/25,2024/10/31,2024/10/31,1,"",,,,,,,5.0,,"",,"",No
Atonement,Ian McEwan,"",9780385721790,paperback,read,2023/10/13,2024/10/25,2024/10/25,1,"",,,,,,,5.0,,"",,"",No
"Peaceful Parent, Happy Kids: How to Stop Yelling and Start Connecting",Laura Markham,"",9780399160288,paperback,to-read,2024/02/27,"","",0,"",,,,,,,,,"",,"",No
Double Indemnity,James M. Cain,"",9780679723226,paperback,to-read,2025/07/28,"","",0,"",,,,,,,,,"",,"",No
You Deserve Each Other,Sarah Hogle,"",9780593085424,paperback,read,2021/05/01,2021/05/01,2021/05/01,1,"",,,,,,,4.0,,"",,"",No
The Two Gentlemen of Verona,William Shakespeare,"Barbara A. Mowat, Paul Werstine",9780671722951,paperback,read,2019/12/15,2020/01/28,2020/01/28,1,"",,,,,,,3.0,,"",,"",No
Excalibur,Bernard Cornwell,Alves Calado (Translator),9788501061157,paperback,read,2019/08/31,2020/03/15,2020/03/15,1,"",,,,,,,,,"",,"",No
The Return of the King,J.R.R. Tolkien,"",9780007488353,paperback,read,2015/10/08,"","",1,"",,,,,,,5.0,,"",,"",No
Those Who Leave and Those Who Stay,Elena Ferrante,"","",digital,read,2023/10/13,2024/05/18,2024/05/18,1,"",,,,,,,5.0,,"",,"",No
In Cold Blood,Truman Capote,"",9780679745587,paperback,read,2015/10/07,"","",1,"",,,,,,,5.0,"Brilliant, masterful.","",,"",No
Avilion,Robert Holdstock,"",9780575083028,paperback,to-read,2021/07/14,"","",0,"",,,,,,,,,"",,"",No
The Lost World,Arthur Conan Doyle,"",9780812967258,paperback,read,2015/10/08,2016/04/07,2016/04/07,1,"",,,,,,,5.0,,"",,"",No
The Way of Kings,Brandon Sanderson,"",9780765326355,hardcover,read,2022/10/02,2022/10/02,2022/10/02,1,"",,,,,,,5.0,,"",,"",No
The Little Paris Bookshop,Nina George,"",9780553418774,hardcover,to-read,2016/06/14,"","",0,"",,,,,,,,,"",,"",No
The King of Bourbon Street,Thea de Salle,"",9781501156076,digital,to-read,2019/09/27,"","",0,"",,,,,,,3.0,,"",,"",No
American Short Story Masterpieces: A Rich Selection of Recent Fiction from America's Best Modern Writers,"","",9780440204237,paperback,to-read,2016/12/08,"","",0,"",,,,,,,,,"",,"",No
The Divine Comedy,Dante Alighieri,Allen Mandelbaum (Translator),9780679433132,hardcover,to-read,2016/12/08,"","",0,"",,,,,,,,,"",,"",No
A History of the Bible: The Book and Its Faiths,John Barton,"",9780241003916,hardcover,read,2023/12/10,2024/10/02,2024/10/02,1,"",,,,,,,4.0,,"",,"",No
Bretonisches Leuchten,Jean-Luc Bannalec,"",9783462050561,paperback,to-read,2019/02/01,"","",0,"",,,,,,,,,"",,"",No
Monday or Tuesday: Eight Stories,Virginia Woolf,"",9780486294537,paperback,read,2020/06/18,2020/06/29,2020/06/29,1,"",,,,,,,4.0,,"",,"",No
The Big Clock,Kenneth Fearing,"",9781590171813,paperback,read,2025/04/10,2025/08/22,2025/08/22,1,"dark, mysterious",medium,A mix,No,No,No,Yes,3.5,"","","","",No
The Wars of the Roses: The Fall of the Plantagenets and the Rise of the Tudors,Dan Jones,"",9780670026678,hardcover,to-read,2024/03/14,"","",0,"",,,,,,,,,"",,"",No
His Last Bow,Arthur Conan Doyle,"",9780755334438,paperback,read,2019/04/30,2019/05/08,2019/05/08,1,"",,,,,,,4.0,,"",,"",No
Mugre rosa,Fernanda Trías,"",9789915652375,paperback,read,2023/10/13,2024/08/28,2024/08/28,1,"",,,,,,,1.0,Insoportablemente aburrido,"",,"",No
A Viagem do Elefante,José Saramago,"",9789722120173,paperback,read,2015/10/08,"","",1,"",,,,,,,4.0,,"",,"",No
Stranger in the Lake,Kimberly Belle,"",9780778311133,paperback,to-read,2020/06/15,"","",0,"",,,,,,,,,"",,"",No
The Guest List,Lucy Foley,"","",digital,read,2023/03/14,2021/08/25,2021/08/25,1,"",,,,,,,3.0,Pretty dumb and fun.,"",,"",No
The House of the Spirits,Isabel Allende,Magda Bogin (Translator),9780553383805,paperback,read,2015/10/07,"","",1,"",,,,,,,5.0,,"",,"",No
The BFG,Roald Dahl,Quentin Blake (Illustrator),9780141311371,paperback,read,2016/02/22,2016/03/15,2016/03/15,1,"",,,,,,,4.0,,"",,"",No
Gods of Jade and Shadow,Silvia Moreno-Garcia,"",9781529402636,hardcover,read,2019/11/06,2021/02/04,2021/02/04,1,"",,,,,,,5.0,,"",,"",No
The King of Clubs - a Hercule Poirot Short Story (Hercule Poirot),Agatha Christie,"",9780062210951,digital,read,2018/10/10,2018/10/10,2018/10/10,1,"",,,,,,,4.0,,"",,"",No
A Murder Is Announced,Agatha Christie,"",9781579126292,hardcover,read,2018/10/31,2018/11/19,2018/11/19,1,"",,,,,,,4.0,,"",,"",No
Vampire of the Mists,Christie Golden,"",9781560761556,paperback,to-read,2025/07/14,"","",0,"",,,,,,,,,"",,"",No
A Tale of Two Cities,Charles Dickens,Richard Maxwell (Contributor),9780141439600,paperback,read,2015/10/07,"","",1,"",,,,,,,4.0,,"",,"",No
"Six Not-So-Easy Pieces: Einstein's Relativity, Symmetry, and Space-Time",Richard P. Feynman,Roger Penrose,9780465023936,paperback,to-read,2016/01/21,"","",0,"",,,,,,,,,"",,"",No
Lying for Money: How Legendary Frauds Reveal the Workings of Our World,Dan Davies,"",,,read,2024/10/09,2024/10/30,2024/10/30,1,"",,,,,,,5.0,,"",,"",No
Digital Minimalism: Choosing a Focused Life in a Noisy World,Cal Newport,"",9780525536512,hardcover,to-read,2019/11/06,"","",0,"",,,,,,,,,"",,"",No
The Prisoner of Heaven,Carlos Ruiz Zafón,Lucia Graves (Translator),9780062206282,hardcover,to-read,2020/07/15,"","",0,"",,,,,,,,,"",,"",No
The Great Gatsby,F. Scott Fitzgerald,"",9780743273565,paperback,read,2015/10/07,"","",1,"",,,,,,,5.0,,"",,"",No
The Summer that Melted Everything,Tiffany McDaniel,"",9781250078063,hardcover,to-read,2016/12/08,"","",0,"",,,,,,,,,"",,"",No
Neverwhere,Neil Gaiman,"",9780060557812,paperback,read,2017/01/28,2017/02/16,2017/02/16,1,"",,,,,,,4.0,,"",,"",No
The Neverending Story,Michael Ende,"Ralph Manheim (Translator), Roswitha Quadflieg (Illustrator)",9780525457589,hardcover,read,2015/10/20,2016/05/26,2016/05/26,1,"",,,,,,,3.0,,"",,"",No
The Nickel Boys,Colson Whitehead,"",9780385693974,digital,to-read,2019/07/08,"","",0,"",,,,,,,,,"",,"",No
The Cider House Rules,John Irving,"",9780786226740,hardcover,read,2016/12/08,2019/08/09,2019/08/09,1,"",,,,,,,5.0,,"",,"",No
La fortuna: BLACKWATER V [Edizione italiana],Michael McDowell,"",9791255020691,digital,read,2024/08/13,2024/09/29,2024/09/29,1,"",,,,,,,4.0,,"",,"",No
Tehanu,Ursula K. Le Guin,"",9781416509639,paperback,read,2024/01/07,2024/02/10,2024/02/10,1,"",,,,,,,4.0,"My least favourite so far. The third act felt rushed. Outside of that, I felt it as meditative and profound in the quiet moments as the rest of them. This book really benefits from it afterword","",,"",No
City Primeval,Elmore Leonard,Frank Muller (Narrator),9780061993725,audio,read,2021/08/25,2022/10/02,2022/10/02,1,"",,,,,,,5.0,,"",,"",No
The Adventure of the Blue Carbuncle,Arthur Conan Doyle,"",9788124200230,paperback,read,2018/10/26,2018/10/29,2018/10/29,1,"",,,,,,,4.0,,"",,"",No
Neurogastronomy: How the Brain Creates Flavor and Why It Matters,Gordon Shepherd,"",9780231159104,hardcover,to-read,2023/12/06,"","",0,"",,,,,,,,,"",,"",No
The Two Towers,J.R.R. Tolkien,"",9780618346264,paperback,read,2015/10/08,"","",1,"",,,,,,,4.0,,"",,"",No
The Dragons of Eden: Speculations on the Evolution of Human Intelligence,Carl Sagan,"",9780345346292,paperback,read,2016/08/01,2017/05/30,2017/05/30,1,"",,,,,,,3.0,,"",,"",No
Providence,Max Barry,"",9780593085172,hardcover,to-read,2021/07/18,"","",0,"",,,,,,,,,"",,"",No
The Last Question,Isaac Asimov,"Bob E. Flick, Jim Gallant",9781884214493,audio,read,2015/10/08,"","",1,"",,,,,,,5.0,,"",,"",No
Such a Fun Age,Kiley Reid,"",9780525541905,hardcover,to-read,2021/02/09,"","",0,"",,,,,,,,,"",,"",No
El mago que se perdió en su sombrero,Lars Vasa Johansson,"",9788416634484,paperback,to-read,2019/02/08,"","",0,"",,,,,,,,,"",,"",No
Marianela,Benito Pérez Galdós,"",9788471551474,paperback,read,2015/10/07,"","",1,"",,,,,,,2.0,"A diferencia de otros libros de Pérez Galdós aquí es imposible dejar ir que viven en otra época. Es decir, este libro no envejece bien y no pude conectarme con los personajes","",,"",No
"Good Omens: The Nice and Accurate Prophecies of Agnes Nutter, Witch","Terry Pratchett, Neil Gaiman",Martin Jarvis (Narrator),9780061735813,audio,read,2019/02/11,2019/03/19,2019/03/19,1,"",,,,,,,3.0,,"",,"",No
Marcelo in the Real World,Francisco X. Stork,"",9780545054744,hardcover,read,2016/06/14,2016/09/22,2016/09/22,1,"",,,,,,,4.0,,"",,"",No
The Man from St. Petersburg,Ken Follett,"",9780451208705,paperback,to-read,2024/03/09,"","",0,"",,,,,,,,,"",,"",No
The Right Swipe,Alisha Rai,"",9780062878090,paperback,read,2019/08/22,2019/09/04,2019/09/04,1,"",,,,,,,3.0,,"",,"",No
The Man in the Iron Mask,Alexandre Dumas,Joachim Neugroschel (Translator),9780140439243,paperback,to-read,2015/10/07,"","",0,"",,,,,,,,,"",,"",No
A Crown of Swords,Robert Jordan,"",9780812550283,paperback,read,2018/08/29,2018/10/10,2018/10/10,1,"",,,,,,,3.0,,"",,"",No
El Huesped Y Otros Relatos Siniestros,Amparo Dávila,"",9786071657008,hardcover,to-read,2019/03/05,"","",0,"",,,,,,,,,"",,"",No
Heads of the Colored People,Nafissa Thompson-Spires,"",9781501167997,hardcover,to-read,2019/03/05,"","",0,"",,,,,,,,,"",,"",No
First Blood,David Morrell,"",9780446364409,paperback,read,2024/01/01,2024/02/21,2024/02/21,1,"",,,,,,,5.0,"This was definitely not the first ""dad book"" that I've read but this is the first book I've finished as a dad. Really engrossing, I read it while holding my beautiful boy: 5 stars experience.","",,"",No
Children of Blood and Bone,Tomi Adeyemi,"",9781250170972,hardcover,read,2018/12/10,2019/12/27,2019/12/27,1,"",,,,,,,4.0,,"",,"",No
The Bone Season,Samantha Shannon,"",9781639732234,hardcover,to-read,2025/07/29,"","",0,"",,,,,,,,,"",,"",No
The Lying Game,Ruth Ware,"",9781501156007,hardcover,to-read,2021/02/28,"","",0,"",,,,,,,,,"",,"",No
The Universe in a Nutshell,Stephen Hawking,"",9780553802023,hardcover,read,2015/10/08,"","",1,"",,,,,,,5.0,,"",,"",No
The Fires of Heaven,Robert Jordan,"",9781857232097,paperback,read,2018/08/29,2018/10/10,2018/10/10,1,"",,,,,,,4.0,,"",,"",No
Η λύση του Διαβόλου,Frederick Forsyth,Γιούρι Κοβαλένκο (Translator),9780553264906,,to-read,2025/07/09,"","",0,"",,,,,,,,,"",,"",No
The Last Picture Show,Larry McMurtry,"",9780752837215,paperback,to-read,2024/08/28,"","",0,"",,,,,,,,,"",,"",No
The Girl Who Kicked the Hornet's Nest,Stieg Larsson,Reg Keeland (Translator),9780307269997,hardcover,read,2017/11/30,2024/05/03,2024/05/03,1,"",,,,,,,4.0,,"",,"",No
The Exchange,John Grisham,"",9780385548953,hardcover,read,2024/03/13,2024/03/25,2024/03/25,1,"",,,,,,,2.0,This book shows that John Grisham has learned enough tricks to write a page-turner thriller with absolutely no substance.,"",,"",No
Red Dragon,Thomas Harris,"","",paperback,read,2022/10/02,2023/07/22,2023/07/22,1,"",,,,,,,5.0,,"",,"",No
History of Wolves,Emily Fridlund,"",9780802125873,hardcover,read,2020/06/29,2020/07/20,2020/07/20,1,"",,,,,,,4.0,,"",,"",No
Lavondyss: Journey to an Unknown Region,Robert Holdstock,"",9780765307316,paperback,to-read,2021/07/14,"","",0,"",,,,,,,,,"",,"",No
Fix Her Up,Tessa Bailey,"",9780062872845,digital,read,2019/09/01,2019/09/27,2019/09/27,1,"",,,,,,,3.0,,"",,"",No
The Feast of the Goat,Mario Vargas Llosa,Edith Grossman (Translator),9780571207763,paperback,read,2015/10/07,"","",1,"",,,,,,,5.0,,"",,"",No
Tess of the D'Urbervilles,Thomas Hardy,Donald Hall,9780451525468,paperback,to-read,2023/11/01,"","",0,"",,,,,,,,,"",,"",No
The Years,Annie Ernaux,Alison L. Strayer (Translator),9781609807870,paperback,to-read,2024/06/17,"","",0,"",,,,,,,,,"",,"",No
The Time Machine,H.G. Wells,"",9786059919166,paperback,read,2015/10/17,2016/01/20,2016/01/20,1,"",,,,,,,3.0,,"",,"",No
The Partner,"Hidayat Saleh, John Grisham","",9780712661362,,to-read,2023/07/22,"","",0,"",,,,,,,,,"",,"",No
News of a Kidnapping,Gabriel García Márquez,Edith Grossman,9780140267839,paperback,read,2015/10/08,"","",1,"",,,,,,,4.0,,"",,"",No
Things You Save in a Fire,Katherine Center,"",9781250047328,hardcover,to-read,2019/07/08,"","",0,"",,,,,,,,,"",,"",No
All the Ugly and Wonderful Things,Bryn Greenwood,"",9781466885806,digital,to-read,2016/12/08,"","",0,"",,,,,,,,,"",,"",No
Fahrenheit 451,Ray Bradbury,Penn Badgley (Narrator),B0F4THQP9L,audio,read,2023/11/01,"","",1,"",,,,,,,5.0,,"",,"",No
Relentless,R.A. Salvatore,"",9780062688675,hardcover,to-read,2021/02/09,"","",0,"",,,,,,,,,"",,"",No
Posdata,Octavio Paz,"",9789682316135,paperback,read,2015/10/17,"","",1,"",,,,,,,4.0,,"",,"",No
The Appeal,John Grisham,"",9780385515047,hardcover,read,2019/08/23,2019/08/24,2019/08/24,1,"",,,,,,,4.0,,"",,"",No
The Disappearance of Mr. Davenheim: a Hercule Poirot Short Story,Agatha Christie,"",,hardcover,read,2018/10/10,2018/10/10,2018/10/10,1,"",,,,,,,3.0,,"",,"",No
Matchmaking for Beginners,Maddie Dawson,"",9781503900684,hardcover,read,2019/07/21,2019/07/21,2019/07/21,1,"",,,,,,,2.0,,"",,"",No
The Fiancée,Kate White,"",9780062945419,paperback,to-read,2021/08/25,"","",0,"",,,,,,,,,"",,"",No
"Trust Me, I'm Lying: Confessions of a Media Manipulator",Ryan Holiday,"",9781591845539,hardcover,read,2016/11/02,2016/11/28,2016/11/28,1,"",,,,,,,4.0,,"",,"",No
Destiny Disrupted: A History of the World Through Islamic Eyes,Tamim Ansary,Tamim Ansary (Narrator),9781433272264,audio,read,2024/03/14,2024/08/30,2024/08/30,1,"",,,,,,,5.0,,"",,"",No
Red Rising,Pierce Brown,"",9780345539786,hardcover,to-read,2017/11/30,"","",0,"",,,,,,,,,"",,"",No
The Valley of Fear,Arthur Conan Doyle,David Timson (Narrator),9789626344248,audio,read,2019/04/16,2019/04/30,2019/04/30,1,"",,,,,,,4.0,,"",,"",No
Stoner,John Williams,John McGahern (Contributor),9781590171998,paperback,read,2024/05/02,2024/08/18,2024/08/18,1,"",,,,,,,2.0,,"",,"",No
Walt Whitman: The Complete Poems,Walt Whitman,"",9780140424515,paperback,read,2015/10/08,"","",1,"",,,,,,,4.0,,"",,"",No
Mrs. Dalloway,Virginia Woolf,Maureen Howard,9780151009985,hardcover,read,2015/10/07,2021/01/22,2021/01/22,2,"",,,,,,,5.0,Really really good.,"",,"",No
Punk 57,Penelope Douglas,"",9781539427766,paperback,to-read,2020/07/17,"","",0,"",,,,,,,,,"",,"",No
The Jaws Log,Carl Gottlieb,Peter Benchley,9781557046772,hardcover,to-read,2023/07/22,"","",0,"",,,,,,,,,"",,"",No
Siege of Darkness,R.A. Salvatore,"",9780786901647,paperback,read,2021/02/09,2021/07/19,2021/07/19,1,"",,,,,,,4.0,,"",,"",No
Will My Cat Eat My Eyeballs?: Big Questions from Tiny Mortals about Death,Caitlin Doughty,Dianné Ruz (Illustrator),9780393652703,hardcover,to-read,2019/12/12,"","",0,"",,,,,,,,,"",,"",No
The Adventure of the Stockbroker's Clerk,Arthur Conan Doyle,"Sidney Paget (Illustrator), The Gunston Trust",9781717482174,paperback,read,2018/10/31,2018/11/19,2018/11/19,1,"",,,,,,,4.0,,"",,"",No
The Rise and Fall of the Dinosaurs: A New History of a Lost World,Steve Brusatte,"",9780062490421,hardcover,to-read,2024/05/02,"","",0,"",,,,,,,,,"",,"",No
The Adventures of Huckleberry Finn,Mark Twain,"",9780142437179,paperback,read,2015/10/17,"","",1,"",,,,,,,5.0,,"",,"",No
Mr. Perfect,Linda Howard,"",9780743482882,paperback,read,2019/02/11,2019/07/08,2019/07/08,1,"",,,,,,,3.0,,"",,"",No
Innocent Erendira and Other Stories,Gabriel García Márquez,"",9780060751586,paperback,read,2015/10/08,"","",1,"",,,,,,,4.0,,"",,"",No
